<?xml version="1.0" encoding="UTF-8"?><?xml-stylesheet type="text/xsl" href="database.xsl"?>
<database xmlns:xsi="http://www.w3.org/2001/XMLSchema-instance" xsi:noNamespaceSchemaLocation="database.xsd">
    <caption>虚拟币交易所数据库结构</caption>
    <home></home>
    <tables>
        <table code="emailvalidate">
            <name>服务调用记录表</name>
            <remark />
            <fields>
                <field code="UID_" type="int(11)" null="false">
                    <name>主键UID</name>
                </field>
                <field code="CorpNo_" type="varchar(10)" null="false">
                    <name></name>
                </field>
                <field code="Service_" type="varchar(80)" null="false">
                    <name>执行服务</name>
                </field>
                <field code="Trans_" type="bit(1)" null="false">
                    <name>Trans_</name>
                </field>
                <field code="TickCount_" type="decimal(18,6)" null="false">
                    <name>执行毫秒时间</name>
                </field>
                <field code="AppUser_" type="varchar(10)" null="false">
                    <name>建档人员</name>
                </field>
                <field code="AppDate_" type="datetime(19)" null="true">
                    <name>建档日期</name>
                </field>
                <field code="Client_" type="bit(1)" null="false">
                    <name>是否客户端调用</name>
                </field>
                <field code="DataIn_" type="mediumtext(16777215)" null="true">
                    <name>传入参数</name>
                </field>
            </fields>
        </table>
        <table code="emailvalidate">
            <name>邮箱验证链接</name>
            <remark />
            <fields>
                <field code="fId" type="int(11)" null="false">
                    <name>主键Id</name>
                </field>
                <field code="fUuid" type="varchar(128)" null="false">
                    <name>发送邮件编号</name>
                </field>
                <field code="FUs_fId" type="int(11)" null="true">
                    <name>fuser.fId</name>
                </field>
                <field code="fCreateTime" type="datetime(19)" null="true">
                    <name>创建时间</name>
                </field>
                <field code="fValidateTime" type="datetime(19)" null="true">
                    <name>验证时间</name>
                </field>
                <field code="version" type="int(11)" null="true">
                    <name>版本</name>
                </field>
                <field code="type" type="int(11)" null="true">
                    <name>邮件类别</name>
                </field>
                <field code="fmail" type="varchar(128)" null="true">
                    <name>邮件地址</name>
                </field>
                <field code="fNewUUid" type="varchar(128)" null="true">
                    <name>新的发送邮件编号</name>
                </field>
            </fields>
        </table>
        <table code="fabout">
            <name>关于系统</name>
            <remark />
            <fields>
                <field code="fid" type="int(11)" null="false">
                    <name>主键fId</name>
                </field>
                <field code="ftitle" type="varchar(128)" null="true">
                    <name>标题-中文</name>
                </field>
                <field code="ftitle_en" type="varchar(128)" null="true">
                    <name>标题-英文</name>
                </field>
                <field code="ftitle_in" type="varchar(128)" null="true">
                    <name>标题-印度文</name>
                </field>
                <field code="fcontent" type="mediumtext(16777215)" null="true">
                    <name>内容-中文</name>
                </field>
                <field code="fcontent_en" type="mediumtext(16777215)" null="true">
                    <name>内容-英文</name>
                </field>
                <field code="fcontent_in" type="mediumtext(16777215)" null="true">
                    <name>内容-印度文</name>
                </field>
                <field code="ftype" type="varchar(100)" null="true">
                    <name>帮助类型-中文</name>
                </field>
                <field code="ftype_en" type="varchar(100)" null="true">
                    <name>帮助类型-英文</name>
                </field>
                <field code="ftype_in" type="varchar(100)" null="true">
                    <name>帮助类型-印度文</name>
                </field>
                <field code="fisview" type="tinyint(4)" null="true">
                    <name>是否可见</name>
                </field>
            </fields>
        </table>
        <table code="fadmin">
            <name>管理员列表</name>
            <remark />
            <fields>
                <field code="fId" type="int(11)" null="false">
                    <name>主键fId</name>
                </field>
                <field code="fName" type="varchar(32)" null="true">
                    <name>登录名</name>
                </field>
                <field code="fPassword" type="varchar(32)" null="true">
                    <name>密码</name>
                </field>
                <field code="fCreateTime" type="datetime(19)" null="true">
                    <name>创建时间</name>
                </field>
                <field code="fLevel" type="int(11)" null="true">
                    <name>等级</name>
                </field>
                <field code="fStatus" type="int(11)" null="true">
                    <name>状态</name>
                </field>
                <field code="version" type="int(11)" null="true">
                    <name>版本</name>
                </field>
                <field code="froleId" type="int(11)" null="true">
                    <name>frole.fid</name>
                </field>
                <field code="salt" type="varchar(50)" null="true">
                    <name>salt</name>
                </field>
                <field code="fuserid" type="int(11)" null="true">
                    <name>fuserid</name>
                </field>
                <field code="fregPass" type="varchar(50)" null="true">
                    <name>fregPass</name>
                </field>
                <field code="fwidPass" type="varchar(50)" null="true">
                    <name>fwidPass</name>
                </field>
            </fields>
        </table>
        <table code="fads">
            <name>广告列表</name>
            <remark />
            <fields>
                <field code="fid" type="int(11)" null="false">
                    <name></name>
                </field>
                <field code="ftitle" type="varchar(100)" null="true">
                    <name>中文标题</name>
                </field>
                <field code="ftitle_en" type="varchar(100)" null="true">
                    <name>英文标题</name>
                </field>
                <field code="fimages" type="varchar(100)" null="true">
                    <name>图片地址</name>
                </field>
                <field code="fcreatetime" type="datetime(19)" null="true">
                    <name>创建时间</name>
                </field>
                <field code="furl" type="varchar(100)" null="true">
                    <name>跳转链接</name>
                </field>
            </fields>
        </table>
        <table code="fapi">
            <name>第三方服务连接参数表</name>
            <remark />
            <fields>
                <field code="fid" type="int(11)" null="false">
                    <name></name>
                </field>
                <field code="fpartner" type="varchar(128)" null="true">
                    <name>合作伙伴</name>
                </field>
                <field code="fsecret" type="varchar(256)" null="true">
                    <name>链接</name>
                </field>
                <field code="fuser" type="int(11)" null="true">
                    <name>fuser.fId</name>
                </field>
                <field code="label" type="varchar(128)" null="true">
                    <name>相关信息</name>
                </field>
            </fields>
        </table>
        <table code="fappversion">
            <name>App版本信息表</name>
            <remark />
            <fields>
                <field code="fid" type="int(11)" null="false">
                    <name></name>
                </field>
                <field code="type" type="int(11)" null="false">
                    <name>app类别（0安卓 1苹果）</name>
                </field>
                <field code="update_readme" type="varchar(255)" null="true">
                    <name>版本更新日志</name>
                </field>
                <field code="version" type="varchar(32)" null="false">
                    <name>版本号</name>
                </field>
                <field code="update_reset" type="tinyint(1)" null="true">
                    <name>是否强制更新</name>
                </field>
                <field code="url" type="varchar(255)" null="true">
                    <name>app地址</name>
                </field>
                <field code="create_time" type="datetime(19)" null="true">
                    <name>创建时间</name>
                </field>
                <field code="update_time" type="datetime(19)" null="true">
                    <name>修改时间</name>
                </field>
            </fields>
        </table>
        <table code="farticle">
            <name>资讯列表</name>
            <remark />
            <fields>
                <field code="fId" type="int(11)" null="false">
                    <name>id</name>
                </field>
                <field code="fCreateAdmin" type="int(11)" null="true">
                    <name>fadmin.fId</name>
                </field>
                <field code="fModifyAdmin" type="int(11)" null="true">
                    <name>fadmin.fId</name>
                </field>
                <field code="fArticleType" type="int(11)" null="true">
                    <name>farticletype.fId</name>
                </field>